{
  "schema_version": 1,
  "kind": "sparkinterval.ternary-goldbach.compact-receipt-closure.v1",
  "source_pins": {
    "external_atom_catalog": {
      "path": "specifications/TERNARY_GOLDBACH_EXTERNAL_ATOMS.json",
      "sha256": "69cc423a4f14caa032fc1cb91512c9a9402e725912e8c2bca9245c539fe27d12"
    },
    "external_atom_readiness": {
      "path": "specifications/TERNARY_GOLDBACH_EXTERNAL_ATOM_READINESS.json",
      "sha256": "8fd06029d418f48a59e824fc7c8209bb3c83d092c923b79d198ad5f4de179afc"
    },
    "semantic_bindings": {
      "path": "specifications/TERNARY_GOLDBACH_AZURE_SEMANTIC_BINDINGS.json",
      "sha256": "a2536e7efa688b1f85ffb78a0f54f8c942bf98c7092b789909405eae01c44416"
    }
  },
  "scope": {
    "external_atom_count": 13,
    "lowered_endpoint_id": "goldbach-finite-below-10pow27",
    "logical_claim_count": 14,
    "physical_campaign_count": 11
  },
  "generic_boundary": {
    "receipt_fact": "SparkInterval.Execution.Architecture.CompactInputReceiptExecutionFact",
    "universal_executable_refinement": "SparkInterval.Execution.Architecture.ArchitectureRefinesNativeChecker",
    "claim_composition_theorem": "SparkInterval.Execution.Architecture.claim_of_compactInputReceipt",
    "local_production_input_replay_required": false
  },
  "campaigns": [
    {
      "campaign_id": "ch25-a7-boundary",
      "logical_claim_ids": [
        "ch25-a7-boundary"
      ],
      "backend_class": "cpu_flint_sidecar",
      "execution_mode": "single_job",
      "implementation_sources": [
        "tg_verifier/a7_flint.py",
        "tg_verifier/a7_lean_certificate.py",
        "tools/tg_a7_azure_measured_workload.py"
      ],
      "registered_identity": {
        "invocation": "ch25A7BoundaryProductionV1",
        "algorithm": "ch25A7BoundaryV1",
        "algorithm_id": "sparkinterval.ternary-goldbach.ch25-lemma-a7-boundary.v1",
        "algorithm_hash": "340dc36f2ceb992ab16e34c534cd97b786d348ba057e159c295b3abd1328cdfa",
        "canonical_input_selector": "SparkInterval.Execution.RegisteredAlgorithm.ch25A7BoundaryInput",
        "input_hash": "4e45410d2d26467dbd5f78f8ea536b1a8bbf44f1cd5248e234b985bd1f595674",
        "parameters_hash": "f377fb7b8c8d8d033083a0759841411d9bb955e919041f2a5b5be830ed69212e",
        "domain_hash": "629d9c7b3c084ef33f69d92abbe22b5120bac210fc963191c4b1e8289ff1dea5",
        "success_result": {
          "selector": "SparkInterval.Execution.ch25A7BoundarySuccessOutput",
          "bytes_utf8": "true",
          "pin": {
            "byte_length": 4,
            "sha256": "b5bea41b6c623f7c09f1bf24dcae58ebab3c0cdd90ad966bc43a45b44867e12b"
          }
        }
      },
      "physical_compact_pins": {
        "status": "incomplete_pre_run",
        "target": "azure_sev_snp_cpu",
        "receipt_hash": null,
        "measurement_scheme_id": null,
        "machine_semantics_id": null,
        "entry_point": null,
        "executable": null,
        "input": null,
        "result": {
          "byte_length": 4,
          "sha256": "b5bea41b6c623f7c09f1bf24dcae58ebab3c0cdd90ad966bc43a45b44867e12b"
        }
      },
      "lean_soundness": {
        "status": "conditional_evidence_to_claim_present",
        "evidence_type": "A7BoundarySuccessEvidence.SuccessEvidence",
        "evidence_to_claim_theorem": "SparkInterval.TernaryGoldbach.A7BoundarySuccessEvidence.sourceClaim_of_successEvidence",
        "registered_success_theorem": "SparkInterval.Execution.RegisteredInvocation.ch25A7BoundaryProductionV1_sourceClaim",
        "native_bytes_to_evidence_theorem": null
      },
      "machine_refinement": {
        "status": "missing_exact_binary_refinement",
        "exact_executable_refinement": false,
        "compiler_linker_loader_refinement": false
      },
      "receipt_closure": {
        "adapter_kind": "a7-transcript-success-evidence",
        "receipt_scope": "direct_single_process",
        "one_ordinary_process_receipt_sufficient": true,
        "can_one_closed_campaign_receipt_eventually_suffice": true,
        "can_one_receipt_yield_claim_now": false,
        "generic_composition_theorem": "SparkInterval.Execution.Architecture.claim_of_compactInputReceipt",
        "per_campaign_adapter": "SparkInterval.TernaryGoldbach.A7BoundaryCompactChecker.sourceClaim_of_compactRun",
        "missing_proofs": [
          "closed_reviewed_physical_pins",
          "exact_executable_to_native_checker_refinement",
          "native_checker_acceptance_to_lean_evidence",
          "source_analytic_realization"
        ]
      }
    },
    {
      "campaign_id": "ch25-psi-two-pass-v1",
      "logical_claim_ids": [
        "ch25-psi-1e13"
      ],
      "backend_class": "cpu_exact_sidecar",
      "execution_mode": "manual_phase_dag",
      "implementation_sources": [
        "reference/tg_psi_residual_shard.cpp",
        "tg_verifier/psi_residual_campaign.py",
        "tools/tg_azure_cpu_psi_materializer.py"
      ],
      "registered_identity": {
        "invocation": "ch25PsiLemma92ProductionV1",
        "algorithm": "ch25PsiLemma92V1",
        "algorithm_id": "sparkinterval.ternary-goldbach.ch25-psi-lemma-9-2.v1",
        "algorithm_hash": "b16368f84ca70c2a3e7b9b9814c7e098e79c0c3bb137a51b85851cfd526753b0",
        "canonical_input_selector": "SparkInterval.Execution.RegisteredAlgorithm.ch25PsiLemma92Input",
        "input_hash": "35368234a47ea3acdac04c55453f07cc5deb051fdf2238e865d683b17b11d3d8",
        "parameters_hash": "ddc632e84956e223e9df686d02aab167b52cd902dfcedf6ae3a7ccccdd0f6637",
        "domain_hash": "2a19d38cb3c36f9371c741701b7046b6c99dfba94f12185bd8625fad2e8f921f",
        "success_result": {
          "selector": "SparkInterval.Execution.ch25PsiLemma92SuccessOutput",
          "bytes_utf8": "true",
          "pin": {
            "byte_length": 4,
            "sha256": "b5bea41b6c623f7c09f1bf24dcae58ebab3c0cdd90ad966bc43a45b44867e12b"
          }
        }
      },
      "physical_compact_pins": {
        "status": "incomplete_pre_run",
        "target": "azure_sev_snp_cpu",
        "receipt_hash": null,
        "measurement_scheme_id": null,
        "machine_semantics_id": null,
        "entry_point": null,
        "executable": null,
        "input": null,
        "result": {
          "byte_length": 4,
          "sha256": "b5bea41b6c623f7c09f1bf24dcae58ebab3c0cdd90ad966bc43a45b44867e12b"
        }
      },
      "lean_soundness": {
        "status": "conditional_evidence_to_claim_present",
        "evidence_type": "PsiPrimePowerCertificate.GapSourceScaleEvidence",
        "evidence_to_claim_theorem": "SparkInterval.TernaryGoldbach.PsiPrimePowerCertificate.sourceClaim_of_gap_evidence",
        "registered_success_theorem": "SparkInterval.Execution.RegisteredInvocation.ch25PsiLemma92ProductionV1_sourceClaim",
        "native_bytes_to_evidence_theorem": null
      },
      "machine_refinement": {
        "status": "missing_exact_binary_refinement",
        "exact_executable_refinement": false,
        "compiler_linker_loader_refinement": false
      },
      "receipt_closure": {
        "adapter_kind": "psi-two-pass-gap-source-evidence",
        "receipt_scope": "transitive_campaign_graph",
        "one_ordinary_process_receipt_sufficient": false,
        "can_one_closed_campaign_receipt_eventually_suffice": true,
        "can_one_receipt_yield_claim_now": false,
        "generic_composition_theorem": "SparkInterval.Execution.Architecture.claim_of_compactInputReceipt",
        "per_campaign_adapter": "SparkInterval.TernaryGoldbach.PsiCompactChecker.sourceClaim_of_compactRun",
        "missing_proofs": [
          "closed_reviewed_physical_pins",
          "exact_executable_to_native_checker_refinement",
          "native_checker_acceptance_to_lean_evidence",
          "transitive_child_execution_closure"
        ]
      }
    },
    {
      "campaign_id": "platt-head-2e4",
      "logical_claim_ids": [
        "platt-head-2e4"
      ],
      "backend_class": "cpu_flint_sidecar",
      "execution_mode": "single_job",
      "implementation_sources": [
        "tg_verifier/zeta_zero_campaign.py",
        "tools/tg_zeta_campaign.py",
        "tools/tg_platt_head_azure_measured_workload.py"
      ],
      "registered_identity": {
        "invocation": "plattHead2e4ProductionV1",
        "algorithm": "plattHead2e4V1",
        "algorithm_id": "sparkinterval.ternary-goldbach.platt-head-2e4.v1",
        "algorithm_hash": "de33cb0d8db40a6b28c32605d9014ca8d593e446e4d1e3390402ea45c13f29ca",
        "canonical_input_selector": "SparkInterval.Execution.RegisteredAlgorithm.plattHead2e4Input",
        "input_hash": "a2409d869f3084fec413d4e7035f17749f4d2a572cd03f6f847f3352a78aca1d",
        "parameters_hash": "af039df434d373002440517fb4b4dd817a8e9fd5028116885df6f2466598986a",
        "domain_hash": "cfbcfeda2b76f99622befbf795d666b745ec45b82691f73bada7b04399464d11",
        "success_result": {
          "selector": "SparkInterval.Execution.plattHead2e4SuccessOutput",
          "bytes_utf8": "true",
          "pin": {
            "byte_length": 4,
            "sha256": "b5bea41b6c623f7c09f1bf24dcae58ebab3c0cdd90ad966bc43a45b44867e12b"
          }
        }
      },
      "physical_compact_pins": {
        "status": "incomplete_pre_run",
        "target": "azure_sev_snp_cpu",
        "receipt_hash": null,
        "measurement_scheme_id": null,
        "machine_semantics_id": null,
        "entry_point": null,
        "executable": null,
        "input": null,
        "result": {
          "byte_length": 4,
          "sha256": "b5bea41b6c623f7c09f1bf24dcae58ebab3c0cdd90ad966bc43a45b44867e12b"
        }
      },
      "lean_soundness": {
        "status": "conditional_evidence_to_claim_present",
        "evidence_type": "ZetaHeadSourceSemantics.CheckedQ128HeadEvidence",
        "evidence_to_claim_theorem": "SparkInterval.TernaryGoldbach.ZetaHeadSourceSemantics.q128SourceClaim_of_checked_evidence",